include/master-slave.inc
[connection master]
# MDEV-16252: MINIMAL binlog_row_image does not work for versioned tables
set @old_row_image= @@binlog_row_image;
set binlog_row_image= minimal;
create or replace table t1 (pk int, i int, primary key(pk))
with system versioning;
insert into t1 values (1,10),(2,20);
update t1 set i = 0;
connection slave;
connection master;
drop table t1;
set binlog_row_image= @old_row_image;
#
# MDEV-23486 RBR can bypass secure_timestamp=YES
#
create table t1 (a int, rs timestamp(6) not null, re timestamp(6) not null);
connection slave;
stop slave;
drop table t1;
create table t1 (a int, rs timestamp(6) as row start, re timestamp(6) as row end,  period for system_time(rs,re)) with system versioning;
start slave;
set @@session.time_zone= '+00:00';
connection master;
# create two rows on the slave: one in the past, one with some fake row_start
insert t1 values (1, '2010-10-10 10:10:10', '2011-11-11 11:11:11');
insert t1 values (2, '2010-10-10 10:10:10', from_unixtime(2147483647.999999));
connection slave;
select @@secure_timestamp;
@@secure_timestamp
YES
select a, rs = '2010-10-10 10:10:10' as manual, check_row(rs, re) from t1 for system_time all order by a;
a	manual	check_row(rs, re)
1	0	CURRENT ROW
2	0	CURRENT ROW
connection master;
# now update the versioned row on the slave without leaving any trace
update t1 set a= 3, rs= '2009-09-09 9:9:9' where a = 2;
connection slave;
select a, rs != '2009-09-09 9:9:9' as ok, check_row(rs, re) from t1 for system_time all order by a;
a	ok	check_row(rs, re)
1	1	CURRENT ROW
2	1	HISTORICAL ROW
3	1	CURRENT ROW
connection master;
drop table t1;
include/rpl_end.inc
